{
  "schema_version": "ISRAS-CHANGE-CLASSIFICATION-V1",
  "change_id": "example-change",
  "base_commit": "1111111111111111111111111111111111111111",
  "selected_class": "C0",
  "impacts": {
    "editorial_only": true,
    "tooling": false,
    "implementation": false,
    "security_or_authority": false,
    "schema_or_migration": false,
    "acceptance_semantics": false,
    "release_or_recovery": false
  },
  "campaigns": [
    "policy",
    "documentation-sync",
    "links",
    "whitespace"
  ],
  "applicable_controls": [
    "ISRAS-DOC-001"
  ],
  "classification_rationale": "Example non-semantic editorial change with no behavior impact.",
  "changed_paths_reviewed": true,
  "split_recommended": false
}
