{
  "schema_version": "ISRAS-CHANGE-CLASSIFICATION-V1",
  "change_id": "isras-v3-assurance-hardening-foundation",
  "base_commit": "08a0a514ec308f76dbf80ffdcb8caa70ce6e345f",
  "selected_class": "C5",
  "impacts": {
    "editorial_only": false,
    "tooling": true,
    "implementation": false,
    "security_or_authority": true,
    "schema_or_migration": true,
    "acceptance_semantics": true,
    "release_or_recovery": false
  },
  "campaigns": [
    "approval-independence",
    "authority-record",
    "compatibility",
    "destructive-safeguards",
    "documentation-sync",
    "esia",
    "evidence-relationship",
    "exact-pushed-source",
    "findings-separation",
    "fresh-clone",
    "historical-migration",
    "hostile-testing",
    "integration",
    "links",
    "migration-integrity",
    "phase-review",
    "policy",
    "portable",
    "predecessor-revalidation",
    "representative-data",
    "revocation-retry-race",
    "rollback-restore",
    "threat-abuse",
    "tool-environment",
    "traceability",
    "unit-regression",
    "whitespace"
  ],
  "applicable_controls": [
    "ISRAS-GOV-004",
    "ISRAS-GOV-005",
    "ISRAS-GOV-006",
    "ISRAS-GOV-007",
    "ISRAS-PHS-001",
    "ISRAS-PHS-002",
    "ISRAS-PHS-003",
    "ISRAS-SUP-001",
    "ISRAS-SUP-002",
    "ISRAS-EVD-001",
    "ISRAS-EVD-003",
    "ISRAS-EVD-004",
    "ISRAS-BST-001",
    "ISRAS-BST-002",
    "ISRAS-BST-003",
    "ISRAS-BST-004",
    "ISRAS-DIG-001",
    "ISRAS-EVD-005",
    "ISRAS-EVD-006",
    "ISRAS-EVD-007",
    "ISRAS-EVD-008",
    "ISRAS-EVD-009",
    "ISRAS-MAP-001",
    "ISRAS-MAP-002",
    "ISRAS-GOV-008",
    "ISRAS-SCM-001",
    "ISRAS-CHG-001",
    "ISRAS-CHG-002",
    "ISRAS-CHG-003",
    "ISRAS-CHG-004"
  ],
  "classification_rationale": "This candidate changes validator decision semantics, evidence contracts, bootstrap trust, GitHub control evaluation, and assurance schemas. C5 is required; security and schema campaigns remain applicable without classifying the work as a release operation.",
  "changed_paths_reviewed": true,
  "split_recommended": false
}
